[
  {
    "counterclaimId": "canada-counterclaim-001",
    "caseId": "canada",
    "claim": "Canada's restrained-reordering coding assumes a stable symbolic order, but the ongoing Quebec sovereignty crisis and unresolved questions of Indigenous rights and treaty obligations indicate a symbolic order under chronic contestation that may be better coded as hybrid-transitional or stagnation.",
    "effect": "qualifies",
    "targetClaimIds": [],
    "sourceIds": [],
    "rationale": "The Canadian symbolic order has not achieved the kind of settled corrigibility that postwar Germany or Switzerland exhibit — its restrained-reordering is internally contested and periodically destabilized by nationalist and Indigenous mobilization.",
    "reviewStatus": "draft",
    "publicationStatus": "draft"
  }
]