[
  {
    "counterclaimId": "confederacy-counterclaim-001",
    "caseId": "confederacy",
    "claim": "The Confederacy's collapse outcome may mischaracterize what occurred: the Confederate sacred political order did not collapse but was militarily defeated while surviving culturally as the Lost Cause mythology, which continued to organize sacrifice, memory, and political identity across the post-war South for generations.",
    "effect": "complicates",
    "targetClaimIds": [],
    "sourceIds": [],
    "rationale": "A collapse coding implies the sacred political order lost coherence; the Lost Cause tradition demonstrates the Confederate order retained significant symbolic vitality despite military defeat, suggesting symbolic-transformation or frozen-pathology may be more accurate than collapse for the post-1865 period.",
    "reviewStatus": "draft",
    "publicationStatus": "draft"
  }
]